{
  "id": "strength_temp",
  "name": "Strength (this turn)",
  "kind": "buff",
  "decay": "end_of_turn_remove",
  "stacks": true,
  "description": "Adds its amount to attack damage per hit, exactly like Strength, but is removed at the end of the owner's turn (Flex-style burst). Behavior: core/powers/StrengthTemp.gd; removal: CombatManager._decay_statuses (end_of_turn_remove)."
}
